{
  "$schema": "https://json-schema.org/draft/2020-12/schema",
  "$id": "https://wefter.dev/schemas/product-shaping-config.schema.json",
  "type": "object",
  "required": ["version", "workflowName", "releaseId", "specRoot", "runRoot", "contractPath", "processDocPath", "requiredFiles", "completionGate"],
  "properties": {
    "version": { "const": 1 },
    "workflowName": { "const": "product-shaping" },
    "releaseId": { "type": "string", "minLength": 1 },
    "specRoot": { "$ref": "#/$defs/relativePath", "default": ".wefter/specs" },
    "runRoot": { "$ref": "#/$defs/relativePath", "default": ".wefter/runs/product-shaping" },
    "contractPath": { "$ref": "#/$defs/relativePath" },
    "processDocPath": { "$ref": "#/$defs/relativePath" },
    "requiredFiles": {
      "type": "array",
      "minItems": 17,
      "maxItems": 17,
      "prefixItems": [
        { "const": "README.md" },
        { "const": "discovery/SOURCE_MATERIALS.md" },
        { "const": "discovery/IDEA_BRIEF.md" },
        { "const": "discovery/OPEN_QUESTIONS.md" },
        { "const": "references/README.md" },
        { "const": "PRODUCT_VISION.md" },
        { "const": "product/FEATURE_CATALOG.md" },
        { "const": "product/MODULE_ROADMAP.md" },
        { "const": "product/DOMAIN_MODEL.md" },
        { "const": "product/OPERATIONAL_FLOW.md" },
        { "const": "product/PRODUCT_DECISIONS.md" },
        { "const": "releases/README.md" },
        { "const": "releases/<release-id>/README.md" },
        { "const": "releases/<release-id>/SCOPE.md" },
        { "const": "releases/<release-id>/DOMAIN_SPEC.md" },
        { "const": "releases/<release-id>/ACCEPTANCE_CRITERIA.md" },
        { "const": "releases/<release-id>/DELIVERABLES.md" }
      ],
      "items": false
    },
    "completionGate": {
      "type": "object",
      "required": ["requireNoReleaseBlockingQuestions", "requireAdversarialReview", "requireFinalValidation", "readyDeliverableStatuses"],
      "properties": {
        "requireNoReleaseBlockingQuestions": { "type": "boolean" },
        "requireAdversarialReview": { "const": true },
        "requireFinalValidation": { "const": true },
        "readyDeliverableStatuses": {
          "type": "array",
          "minItems": 1,
          "items": { "enum": ["ready"] }
        }
      },
      "additionalProperties": false
    }
  },
  "additionalProperties": false,
  "$defs": {
    "relativePath": {
      "type": "string",
      "minLength": 1,
      "pattern": "^(?![A-Za-z]:)(?![\\\\/])(?!.*(?:^|/)\\.\\.(?:/|$))[^\\\\\r\n]+$"
    }
  }
}
